{
 "schema": "ask4mo.release_evidence.v1",
 "note": "Evidence ledger. Nothing is PASS without a human-supplied or CI-produced artefact link here. Engineering and CI are derived from PACKAGE_STATUS and this ledger's PR rows; live staging, human qualification and gate acceptance are recorded as NOT RUN / OPEN / NOT ACCEPTED until a real artefact exists. Seeded 2026-10-22 by 08A0 from git history and the committed dashboards; a human reviews every change.",
 "as_of": "2026-10-22",
 "main_sha": "f5cf7cb4",
 "policy": {
  "gate_evidence_valid_days": 30,
  "language_approval_valid_days": 90,
  "layer_evidence_valid_days": 30
 },
 "pull_requests": [
  {
   "number": 213,
   "title": "First-wave integration documentation",
   "branch": "docs/first-wave-integration",
   "head_sha": "e94a3af3d3a3116675b5485ded68da06dcfbb680",
   "merge_sha": "8a66d188f199af3e2e844f436adbdf11b0c624e3",
   "merged_at": "2026-10-21",
   "package": null,
   "ci": {
    "result": "success",
    "checks": "",
    "source": "docs/production/execution/RELEASE_READINESS_TRACKER.md section 8 (merged after green GitHub CI) and PACKAGE_STATUS",
    "url": "https://github.com/moaltamimi-unbiasedtalent/Intelligent-Interview-Coach/pull/213/checks"
   },
   "recorded_by": "08A0 seed: git merge history (merge commit and second parent) plus the committed dashboards",
   "recorded_on": "2026-10-22"
  },
  {
   "number": 214,
   "title": "06A Locale audit and language boundaries",
   "branch": "feat/06a-locale-boundaries",
   "head_sha": "a7559a9d06cc681966e0121b35329ced167ae7c3",
   "merge_sha": "f9a06a928c3c1b7f7a410ec29f15a5a29e0a520c",
   "merged_at": "2026-10-22",
   "package": "06A",
   "ci": {
    "result": "success",
    "checks": "",
    "source": "docs/production/execution/RELEASE_READINESS_TRACKER.md section 8 (merged after green GitHub CI) and PACKAGE_STATUS",
    "url": "https://github.com/moaltamimi-unbiasedtalent/Intelligent-Interview-Coach/pull/214/checks"
   },
   "recorded_by": "08A0 seed: git merge history (merge commit and second parent) plus the committed dashboards",
   "recorded_on": "2026-10-22"
  },
  {
   "number": 215,
   "title": "02K Knowledge runtime and manifest contract (interface package)",
   "branch": "feat/02k-knowledge-contract",
   "head_sha": "f5eb3dc1420a2cd3a11c2ee12960c883e28b2c08",
   "merge_sha": "657e45661e7353a12b1619abfa873e01f69dd2e3",
   "merged_at": "2026-10-21",
   "package": "02K",
   "ci": {
    "result": "success",
    "checks": "12/12",
    "source": "docs/production/execution/RELEASE_READINESS_TRACKER.md section 8 (merged after green GitHub CI) and PACKAGE_STATUS",
    "url": "https://github.com/moaltamimi-unbiasedtalent/Intelligent-Interview-Coach/pull/215/checks"
   },
   "recorded_by": "08A0 seed: git merge history (merge commit and second parent) plus the committed dashboards",
   "recorded_on": "2026-10-22"
  },
  {
   "number": 216,
   "title": "03A Admin navigation foundation (REQ-OWN-08)",
   "branch": "feat/03a-admin-navigation",
   "head_sha": "c652b2b1c5579edb2cf4f90ecc9d8c9df950c0a9",
   "merge_sha": "f9218929cf250c9a933111a09a2991c97a760ae6",
   "merged_at": "2026-10-22",
   "package": "03A",
   "ci": {
    "result": "success",
    "checks": "",
    "source": "docs/production/execution/RELEASE_READINESS_TRACKER.md section 8 (merged after green GitHub CI) and PACKAGE_STATUS",
    "url": "https://github.com/moaltamimi-unbiasedtalent/Intelligent-Interview-Coach/pull/216/checks"
   },
   "recorded_by": "08A0 seed: git merge history (merge commit and second parent) plus the committed dashboards",
   "recorded_on": "2026-10-22"
  },
  {
   "number": 217,
   "title": "01B0 Prompt asset format and loader contract (interface package)",
   "branch": "feat/01b0-prompt-contract",
   "head_sha": "6f6d3839564387c137e7f35d168b3b6c5ab8ae4e",
   "merge_sha": "0d75acddf742ddb397c6a14e8d55d7c2bd46c136",
   "merged_at": "2026-10-21",
   "package": "01B0",
   "ci": {
    "result": "success",
    "checks": "12/12",
    "source": "docs/production/execution/RELEASE_READINESS_TRACKER.md section 8 (merged after green GitHub CI) and PACKAGE_STATUS",
    "url": "https://github.com/moaltamimi-unbiasedtalent/Intelligent-Interview-Coach/pull/217/checks"
   },
   "recorded_by": "08A0 seed: git merge history (merge commit and second parent) plus the committed dashboards",
   "recorded_on": "2026-10-22"
  },
  {
   "number": 218,
   "title": "05A Hosted topology and platform hardening",
   "branch": "feat/05a-staging-topology",
   "head_sha": "776d7dde6bb4b3db7bb4b14b352e55cf5163673c",
   "merge_sha": "9b6b1098b023b7d17dad17cc0174e6842de0a864",
   "merged_at": "2026-10-21",
   "package": "05A",
   "ci": {
    "result": "success",
    "checks": "",
    "source": "docs/production/execution/RELEASE_READINESS_TRACKER.md section 8 (merged after green GitHub CI) and PACKAGE_STATUS",
    "url": "https://github.com/moaltamimi-unbiasedtalent/Intelligent-Interview-Coach/pull/218/checks"
   },
   "recorded_by": "08A0 seed: git merge history (merge commit and second parent) plus the committed dashboards",
   "recorded_on": "2026-10-22"
  },
  {
   "number": 219,
   "title": "03K Admin metric and report contract (interface package)",
   "branch": "feat/03k-admin-metric-contract",
   "head_sha": "8afe350aae9d0129d2a05882241a8c59bb7e2e6b",
   "merge_sha": "20241f4a2ec1616c9b1fce171466714fee7058a5",
   "merged_at": "2026-10-21",
   "package": "03K",
   "ci": {
    "result": "success",
    "checks": "12/12",
    "source": "docs/production/execution/RELEASE_READINESS_TRACKER.md section 8 (merged after green GitHub CI) and PACKAGE_STATUS",
    "url": "https://github.com/moaltamimi-unbiasedtalent/Intelligent-Interview-Coach/pull/219/checks"
   },
   "recorded_by": "08A0 seed: git merge history (merge commit and second parent) plus the committed dashboards",
   "recorded_on": "2026-10-22"
  },
  {
   "number": 220,
   "title": "01B Externalized, versioned prompts (REVIEW-02)",
   "branch": "feat/01b-versioned-prompts",
   "head_sha": "7c2b8791725a83e21d9f0eb521a765b39e079a28",
   "merge_sha": "335d303636a8f1cdebe12dd1fba2f97fb3d4224f",
   "merged_at": "2026-10-21",
   "package": "01B",
   "ci": {
    "result": "success",
    "checks": "12/12",
    "source": "docs/production/execution/RELEASE_READINESS_TRACKER.md section 8 (merged after green GitHub CI) and PACKAGE_STATUS",
    "url": "https://github.com/moaltamimi-unbiasedtalent/Intelligent-Interview-Coach/pull/220/checks"
   },
   "recorded_by": "08A0 seed: git merge history (merge commit and second parent) plus the committed dashboards",
   "recorded_on": "2026-10-22"
  },
  {
   "number": 221,
   "title": "02A Permanent Knowledge reliability: persistence, environment identity, restore (REQ-OWN-05)",
   "branch": "feat/02a-knowledge-persistence",
   "head_sha": "5ffef5511087394fc6d9f48aff89b19fd821b008",
   "merge_sha": "191cbc57cde723c8db24ad7b9f61599a4fbb6c85",
   "merged_at": "2026-10-21",
   "package": "02A",
   "ci": {
    "result": "success",
    "checks": "",
    "source": "docs/production/execution/RELEASE_READINESS_TRACKER.md section 8 (merged after green GitHub CI) and PACKAGE_STATUS",
    "url": "https://github.com/moaltamimi-unbiasedtalent/Intelligent-Interview-Coach/pull/221/checks"
   },
   "recorded_by": "08A0 seed: git merge history (merge commit and second parent) plus the committed dashboards",
   "recorded_on": "2026-10-22"
  },
  {
   "number": 222,
   "title": "PREP: version-independent migration head checks",
   "branch": "chore/migration-head-agnostic",
   "head_sha": "ec149638245b121ffbb4156b3896e1daca42a781",
   "merge_sha": "f4c7136cd7271fc14119210c75fb142e0c053083",
   "merged_at": "2026-10-22",
   "package": "PREP",
   "ci": {
    "result": "success",
    "checks": "12/12",
    "source": "docs/production/execution/WAVE2_EXECUTION_DASHBOARD.md section 1 (12 of 12 checks on the final PR head)",
    "url": "https://github.com/moaltamimi-unbiasedtalent/Intelligent-Interview-Coach/pull/222/checks"
   },
   "recorded_by": "08A0 seed: git merge history (merge commit and second parent) plus the committed dashboards",
   "recorded_on": "2026-10-22"
  },
  {
   "number": 223,
   "title": "01A Prompt-injection corpus, risk score and quarantine (REVIEW-01 part 1)",
   "branch": "feat/01a-injection-corpus",
   "head_sha": "b3acd4be581b9909bef2d215943b0002824e2cf9",
   "merge_sha": "75499730a42fa8a8ae0dfe9f199c58afc842c5dc",
   "merged_at": "2026-10-22",
   "package": "01A",
   "ci": {
    "result": "success",
    "checks": "12/12",
    "source": "docs/production/execution/WAVE2_EXECUTION_DASHBOARD.md section 1 (12 of 12 checks on the final PR head)",
    "url": "https://github.com/moaltamimi-unbiasedtalent/Intelligent-Interview-Coach/pull/223/checks"
   },
   "recorded_by": "08A0 seed: git merge history (merge commit and second parent) plus the committed dashboards",
   "recorded_on": "2026-10-22"
  },
  {
   "number": 224,
   "title": "03D1 Command Center metrics and AI operations read model (REQ-OWN-01, backend)",
   "branch": "feat/03d1-command-center-metrics",
   "head_sha": "89f6e66bd130f1130d6e37f1825a238e9ae13bba",
   "merge_sha": "ac029adc8c6f586e30b027589752f3ac9f40ddb6",
   "merged_at": "2026-10-22",
   "package": "03D1",
   "ci": {
    "result": "success",
    "checks": "12/12",
    "source": "docs/production/execution/WAVE2_EXECUTION_DASHBOARD.md section 1 (12 of 12 checks on the final PR head)",
    "url": "https://github.com/moaltamimi-unbiasedtalent/Intelligent-Interview-Coach/pull/224/checks"
   },
   "recorded_by": "08A0 seed: git merge history (merge commit and second parent) plus the committed dashboards",
   "recorded_on": "2026-10-22"
  },
  {
   "number": 225,
   "title": "Wave 2 baseline documents",
   "branch": "docs/wave2-baseline",
   "head_sha": "b344d16b01c66bba6221596cf2bf01dc7a479160",
   "merge_sha": "b5a523115ac347cc133807f6e93c8d08ec714613",
   "merged_at": "2026-10-22",
   "package": null,
   "ci": {
    "result": "success",